{
  "$schema": "http://json-schema.org/draft-07/schema#",
  "title": "SusVibes Leaderboard Submission",
  "description": "Schema for submitting model results to the SusVibes leaderboard",
  "type": "object",
  "required": ["model_name", "model_organization", "submitting_organization", "submission_date", "contact_info", "results"],
  "properties": {
    "model_name": {
      "type": "string",
      "description": "Name of the model being evaluated",
      "examples": ["GPT-4.1", "Claude-3.7-Sonnet", "Custom-Model-v1.0"]
    },
    "model_organization": {
      "type": "string",
      "description": "Organization or company that developed the model",
      "examples": ["OpenAI", "Anthropic", "Google", "My Company"]
    },
    "submitting_organization": {
      "type": "string",
      "description": "Organization that actually ran the evaluation and submitted the results",
      "examples": ["Anthropic", "OpenAI", "Independent Researcher"]
    },
    "submission_date": {
      "type": "string",
      "format": "date",
      "description": "Date of submission in YYYY-MM-DD format"
    },
    "contact_info": {
      "type": "object",
      "required": ["email"],
      "properties": {
        "email": {
          "type": "string",
          "format": "email",
          "description": "Contact email for questions about this submission"
        },
        "name": {
          "type": "string",
          "description": "Name of the submitter"
        },
        "github": {
          "type": "string",
          "description": "GitHub username (optional)"
        }
      }
    },
    "is_new": {
      "type": "boolean",
      "description": "Whether this model should be highlighted as new on the leaderboard",
      "default": false
    },
    "submission_type": {
      "type": "string",
      "enum": ["standard", "custom"],
      "description": "Type of submission: 'standard' uses the default SusVibes evaluation pipeline (a single base LLM + the default tools/prompts, no advanced security strategy), 'custom' uses a modified pipeline (multi-model routers, additional tools, custom prompting, etc.). Custom submissions require detailed methodology documentation.",
      "default": "standard"
    },
    "custom_label": {
      "type": "string",
      "description": "Required for custom submissions. A short, unique label identifying this custom approach (e.g., 'router', 'reflection', 'ensemble'). Used in directory naming ({model}_{framework}_custom-{label}_{date}) and leaderboard display.",
      "pattern": "^[a-z0-9]+(-[a-z0-9]+)*$",
      "examples": ["prompt-strategy", "reflection", "ensemble"]
    },
    "trajectories_available": {
      "type": "boolean",
      "description": "Whether trajectory files are included. Required to be true for a submission to show as Verified.",
      "default": false
    },
    "references": {
      "type": "array",
      "description": "Links to papers, blog posts, documentation, or other resources about this model",
      "items": {
        "type": "object",
        "required": ["title", "url"],
        "properties": {
          "title": {
            "type": "string",
            "description": "Title or description of the reference"
          },
          "url": {
            "type": "string",
            "format": "uri",
            "description": "URL to the reference"
          },
          "type": {
            "type": "string",
            "enum": ["paper", "blog_post", "documentation", "model_card", "github", "huggingface", "other"],
            "description": "Type of reference"
          }
        }
      },
      "default": []
    },
    "results": {
      "type": "object",
      "description": "Performance results (Python)",
      "properties": {
        "python": {
          "type": "object",
          "properties": {
            "func_pass_1": {
              "type": ["number", "null"],
              "minimum": 0,
              "maximum": 100,
              "description": "FuncPass@1 success rate percentage"
            },
            "sec_pass_1": {
              "type": ["number", "null"],
              "minimum": 0,
              "maximum": 100,
              "description": "SecPass@1 success rate percentage"
            },
            "cost": {
              "type": ["number", "null"],
              "minimum": 0,
              "description": "Average cost in USD to run one trajectory (optional)"
            }
          },
          "additionalProperties": false
        }
      },
      "additionalProperties": false
    },
    "methodology": {
      "type": "object",
      "description": "Information about how the evaluation was conducted",
      "required": ["susvibes_version"],
      "properties": {
        "evaluation_date": {
          "type": "string",
          "format": "date",
          "description": "Date when evaluation was conducted"
        },
        "susvibes_version": {
          "type": "string",
          "description": "SusVibes dataset version evaluated on: 'v0.0' (200 tasks) or 'v1.0' (186 tasks). Determines which leaderboard the submission is ranked on; scores are not comparable across versions.",
          "examples": ["v1.0", "v0.0"]
        },
        "agent_framework": {
          "type": ["string", "null"],
          "description": "Agent framework used for evaluation (e.g., 'SWE-agent', 'OpenHands', 'Claude Code', 'Custom'), or null if unknown"
        },
        "notes": {
          "type": "string",
          "description": "Additional notes about the evaluation methodology"
        },
        "verification": {
          "type": "object",
          "description": "Verification details for result authenticity",
          "required": ["modified_prompts", "omitted_questions"],
          "properties": {
            "modified_prompts": {
              "type": "boolean",
              "description": "Whether any modifications were made to the agent prompts"
            },
            "omitted_questions": {
              "type": "boolean", 
              "description": "Whether any questions/tasks were omitted from the evaluation"
            },
            "details": {
              "type": "string",
              "description": "Additional verification details or explanations"
            }
          }
        }
      }
    }
  }
}
