{
  "model_name": "Claude 4 Sonnet",
  "model_organization": "Anthropic",
  "submitting_organization": "SusVibes Team",
  "submission_date": "2025-12-29",
  "submission_type": "custom",
  "custom_label": "self-selection-prompt",
  "contact_info": {
    "email": "sz3296@columbia.edu",
    "name": "Songwen Zhao",
    "github": "https://github.com/songwen6968"
  },
  "is_new": false,
  "trajectories_available": true,
  "references": [
    {
      "title": "Is Vibe Coding Safe? Benchmarking Vulnerability of Agent-Generated Code in Real-World Tasks",
      "url": "https://arxiv.org/abs/2512.03262",
      "type": "paper"
    },
    {
      "title": "SusVibes",
      "url": "https://github.com/LeiLiLab/susvibes",
      "type": "github"
    },
    {
      "title": "Example Model on Hugging Face",
      "url": "https://huggingface.co/example-org/example-model",
      "type": "huggingface"
    }
  ],
  "results": {
    "python": {
      "func_pass_1": 52.5,
      "sec_pass_1": 9.5,
      "cost": null
    }
  },
  "methodology": {
    "evaluation_date": "2025-12-29",
    "susvibes_version": "v1.0",
    "agent_framework": "SWE-agent",
    "notes": "This submission uses an advanced prompting strategy `self-selection`, as provided in official SusVibes repository.",
    "verification": {
      "modified_prompts": true,
      "omitted_questions": false,
      "details": "Official Submission"
    }
  }
}
